{
  "target_protocol_version": "1.0",
  "target_kind": {
    "id": "AuthorityPolicy",
    "version": "1.0"
  },
  "target_instance_id": "pgw:i:b09d7bbc9ace7f189718e56bdddeb4e7",
  "target_revision_id": "pgw:r:23d4449e772e28829d670728cf30796d",
  "target_digest": "sha-256:95a9035a3d2b4b134dc062a0ba50db8086c8ec12229ac48408f692a8a967a0ec",
  "target_workspace_binding": {
    "mode": "bound",
    "workspace_id": "pgw:w:cf4339b1f56441936467dea1357dc30e"
  }
}
