{
  "target_protocol_version": "1.0",
  "target_kind": {
    "id": "ExecutionBundle",
    "version": "1.0"
  },
  "target_instance_id": "pgw:i:064ee0ce2bdeee0073c6d64e93b9fb60",
  "target_revision_id": "pgw:r:c55e6e260130dc58d95c600ee51db65d",
  "target_digest": "sha-256:9a59a420a06f5e00f9529708918a2b9289bcb832aa8a4c983884520f5d6be3d7",
  "target_workspace_binding": {
    "mode": "bound",
    "workspace_id": "pgw:w:cf4339b1f56441936467dea1357dc30e"
  }
}
